id;name;image;code;colors;brand_id;repair_category_id;status;sort_order
5899;Redmi Pad SE;https://fdn2.gsmarena.com/vv/bigpic/xiaomi-pad-se.jpg;;Lavender Purple, Graphite Gray, Mint Green;20;2;;
5900;Redmi K60 Ultra;https://fdn2.gsmarena.com/vv/bigpic/xiaomi-redmi-k60-ultra.jpg;;Black, White, Green;20;1;;
5901;Mix Fold 3;https://fdn2.gsmarena.com/vv/bigpic/xiaomi-mix-fold3-.jpg;;Black, Gold;20;1;;
5902;Pad 6 Max 14;https://fdn2.gsmarena.com/vv/bigpic/xiaomi-pad-6-max-14.jpg;;Black, Silver;20;2;;
5903;Poco M6 Pro;https://fdn2.gsmarena.com/vv/bigpic/xiaomi-poco-m6-pro.jpg;;Power Black, Forest Green;20;1;;
5904;Redmi Watch 3 Active;https://fdn2.gsmarena.com/vv/bigpic/xiaomi-redmi-watch-3-active.jpg;;Black, Gray;20;3;;
5905;Redmi 12 5G;https://fdn2.gsmarena.com/vv/bigpic/xiaomi-redmi-12-5g-.jpg;;Jade Black, Pastel Blue, Moonstone Silver;20;1;;
5906;Redmi Note 12R;https://fdn2.gsmarena.com/vv/bigpic/xiaomi-redmi-note-12r.jpg;;Black, Blue, Silver;20;1;;
5907;Redmi Note 12R Pro;https://fdn2.gsmarena.com/vv/bigpic/xiaomi-redmi-note-12r-pro-.jpg;;Black, White, Gold;20;1;;
5908;Redmi 12;https://fdn2.gsmarena.com/vv/bigpic/xiaomi-redmi-12-.jpg;;Midnight Black, Sky Blue, Polar Silver, Moonstone Silver;20;1;;
5909;Redmi Note 12T Pro;https://fdn2.gsmarena.com/vv/bigpic/xiaomi-redmi-note-12t-pro.jpg;;Blue, White, Black;20;1;;
5910;Civi 3;https://fdn2.gsmarena.com/vv/bigpic/xiaomi-civi-3.jpg;;Purple, Mint, Gold, Gray;20;1;;
5911;Poco F5 Pro;https://fdn2.gsmarena.com/vv/bigpic/xiaomi-poco-f5-pro-2.jpg;;Black, White;20;1;;
5912;Poco F5;https://fdn2.gsmarena.com/vv/bigpic/xiaomi-poco-f5-2.jpg;;Black, Blue, White;20;1;;
5913;13 Ultra;https://fdn2.gsmarena.com/vv/bigpic/xiaomi-13-ultra.jpg;;Black, Olive Green, White, Orange, Yellow, Blue;20;1;;
5914;Pad 6 Pro;https://fdn2.gsmarena.com/vv/bigpic/xiaomi-pad6-pro.jpg;;Black, Blue, Gold;20;2;;
5915;Pad 6;https://fdn2.gsmarena.com/vv/bigpic/xiaomi-pad6.jpg;;Black, Blue, Gold;20;2;;
5916;Poco C51;https://fdn2.gsmarena.com/vv/bigpic/xiaomi-poco-c51.jpg;;Power Black, Royal Blue;20;1;;
5917;Redmi Note 12S;https://fdn2.gsmarena.com/vv/bigpic/xiaomi-redmi-note-12s.jpg;;Onyx Black, Ice Blue, Pearl Green;20;1;;
5918;Redmi Note 12 Pro 4G;https://fdn2.gsmarena.com/vv/bigpic/xiaomi-redmi-note-12-pro-4g.jpg;;Star Blue, Graphite Gray, Polar White, Ice blue;20;1;;
5919;Redmi Note 12 Turbo;https://fdn2.gsmarena.com/vv/bigpic/xiaomi-redmi-note-12-turbo.jpg;;Black, Blue, White, Harry Potter Edition;20;1;;
5920;Redmi A2+;https://fdn2.gsmarena.com/vv/bigpic/xiaomi-redmi-a2-plus.jpg;;Aqua Blue, Classic Black, Sea Green;20;1;;
5921;Redmi A2;https://fdn2.gsmarena.com/vv/bigpic/xiaomi-redmi-a2-.jpg;;Aqua Blue, Classic Black, Sea Green;20;1;;
5922;Redmi Note 12 4G;https://fdn2.gsmarena.com/vv/bigpic/redmi-note-12-4g.jpg;;Onyx Gray, Mint Green, Ice Blue;20;1;;
5923;13 Pro;https://fdn2.gsmarena.com/vv/bigpic/xiaomi-13-pro-black.jpg;;Ceramic White, Ceramic Black, Ceramic Flora Green, Mountain Blue;20;1;;
5924;13;https://fdn2.gsmarena.com/vv/bigpic/xiaomi-13-red.jpg;;White, Black, Flora Green, Mountain Blue, Red, Blue, Yellow, Green, Gray;20;1;;
5925;13 Lite;https://fdn2.gsmarena.com/vv/bigpic/xiaomi-13-lite.jpg;;Black, Lite Blue, Lite Pink;20;1;;
5926;Poco C55;https://fdn2.gsmarena.com/vv/bigpic/xiaomi-poco-c55.jpg;;Cool Blue, Power Black, Forest Green;20;1;;
5927;Poco X5 Pro;https://fdn2.gsmarena.com/vv/bigpic/xiaomi-poco-x5-pro-5g.jpg;;Astral Black, Horizon Blue, Poco Yellow;20;1;;
5928;Poco X5;https://fdn2.gsmarena.com/vv/bigpic/xiaomi-poco-x5-5g.jpg;;Jaguar Black, Wildcat Blue, Supernova Green;20;1;;
5929;Redmi Note 12;https://fdn2.gsmarena.com/vv/bigpic/redmi-note-12-5g-international.jpg;;Frosted Green, Matte Black, Mystique Blue;20;1;;
5930;Poco C50;https://fdn2.gsmarena.com/vv/bigpic/xiaomi-poco-c50.jpg;;Country Green, Royal Blue;20;1;;
5931;Redmi Note 12 Pro Speed;https://fdn2.gsmarena.com/vv/bigpic/xiaomi-redmi-note-12-pro-speed.jpg;;Black, Blue, Green;20;1;;
5932;Redmi K60 Pro;https://fdn2.gsmarena.com/vv/bigpic/xiaomi-redmi-k60-pro.jpg;;Black, White, Mint, Champion Black;20;1;;
5933;Redmi K60E;https://fdn2.gsmarena.com/vv/bigpic/xiaomi-redmi-k60e.jpg;;Black, White, Green;20;1;;
5934;Redmi K60;https://fdn2.gsmarena.com/vv/bigpic/xiaomi-redmi-k60.jpg;;Black, White, Blue, Green;20;1;;
5935;Redmi Watch 3;https://fdn2.gsmarena.com/vv/bigpic/xiaomi-redmi-watch3.jpg;;Black, White;20;3;;
5936;Watch S2;https://fdn2.gsmarena.com/vv/bigpic/xiaomi-watch-s2.jpg;;Black, Silver, Light Gold;20;3;;
5937;Redmi 12C;https://fdn2.gsmarena.com/vv/bigpic/xiaomi-redmi-12c.jpg;;Graphite Gray, Ocean Blue, Mint Green, Lavender Purple;20;1;;
5938;Redmi Note 12 Discovery;https://fdn2.gsmarena.com/vv/bigpic/xiaomi-redmi-note-12-pro-discovery-explorer.jpg;;Black;20;1;;
5939;Redmi Note 12 Pro+;https://fdn2.gsmarena.com/vv/bigpic/xiaomi-redmi-note-12-pro-plus.jpg;;Arctic White, Iceberg Blue, Obsidian Black, Trend edition;20;1;;
5940;Redmi Note 12 Pro;https://fdn2.gsmarena.com/vv/bigpic/xiaomi-redmi-note-12-pro.jpg;;Frosted Blue (Sky Blue), Onyx Black (Midnight Black), Polar White, Stardust Purple;20;1;;
5941;Redmi Note 12 (China);https://fdn2.gsmarena.com/vv/bigpic/xiaomi-redmi-note-12-5g.jpg;;Black, White, Blue;20;1;;
5942;12T Pro;https://fdn2.gsmarena.com/vv/bigpic/xiaomi-12t-pro-.jpg;;Black, Silver, Blue;20;1;;
5943;12T;https://fdn2.gsmarena.com/vv/bigpic/xiaomi-12t-.jpg;;Black, Silver, Blue;20;1;;
5944;Redmi Pad;https://fdn2.gsmarena.com/vv/bigpic/xiaomi-redmi-pad.jpg;;Graphite Gray, Moonlight Silver, Mint Green;20;2;;
5945;Redmi Note 11R;https://fdn2.gsmarena.com/vv/bigpic/xiaomi-redmi-note-11r.jpg;;Black, Blue, Gray;20;1;;
5946;Redmi A1+;https://fdn2.gsmarena.com/vv/bigpic/xiaomi-redmi-a1-plus-new.jpg;;Light Green, Light Blue, Black;20;1;;
5947;Civi 2;https://fdn2.gsmarena.com/vv/bigpic/xiaomi-civi2.jpg;;Black, Blue, Violet, Silver, Hello Kitty;20;1;;
5948;Redmi 11 Prime;https://fdn2.gsmarena.com/vv/bigpic/xiaomi-redmi-11-prime-4g.jpg;;Playful Green, Flashy Black, Peppy Purple;20;1;;
5949;Redmi 11 Prime 5G;https://fdn2.gsmarena.com/vv/bigpic/xiaomi-redmi-10-5g.jpg;;Thunder Black, Chrome Silver, Meadow Green;20;1;;
5950;Redmi A1;https://fdn2.gsmarena.com/vv/bigpic/xiaomi-a1.jpg;;Light Green, Light Blue, Black;20;1;;
5951;Poco M5s;https://fdn2.gsmarena.com/vv/bigpic/xiaomi-poco-m5s.jpg;;Gray, Blue, White;20;1;;
5952;Poco M5;https://fdn2.gsmarena.com/vv/bigpic/xiaomi-poco-m5.jpg;;Black, Green, Yellow;20;1;;
5953;Poco M5 (India);https://fdn2.gsmarena.com/vv/bigpic/xiaomi-poco-m5.jpg;;Poco Yellow, Icy Blue, Power Black;20;1;;
5954;Redmi Note 11 SE (India);https://fdn2.gsmarena.com/vv/bigpic/xiaomi-redmi-note10s.jpg;;Thunder Purple, Cosmic White, Shadow Black, Bifrost Blue;20;1;;
5955;Poco M4 5G;https://fdn2.gsmarena.com/vv/bigpic/xiaomi-poco-m4-5g-global.jpg;;Power Black, Cool Blue, Poco Yellow;20;1;;
5956;Watch S1 Pro;https://fdn2.gsmarena.com/vv/bigpic/xiaomi-watch-s1-pro.jpg;;Black, Silver;20;3;;
5957;Redmi K50 Ultra;https://fdn2.gsmarena.com/vv/bigpic/xiaomi-redmi-k50-ultra.jpg;;Black, Gray, Blue, Mercedes AMG;20;1;;
5958;Mix Fold 2;https://fdn2.gsmarena.com/vv/bigpic/xiaomi-mix-fold-2.jpg;;Black, Gold;20;1;;
5959;Pad 5 Pro 12.4;https://fdn2.gsmarena.com/vv/bigpic/xiaomi-mi-pad-5-pro-124.jpg;;Black, Silver, Green;20;2;;
5960;Redmi K50i;https://fdn2.gsmarena.com/vv/bigpic/xiaomi-redmi-k50i-5g.jpg;;Phantom Blue, Stealth Black, Quick Silver;20;1;;
5961;12 Lite;https://fdn2.gsmarena.com/vv/bigpic/xiaomi-12-lite-5g-new.jpg;;Black, Lite Green, Lite Pink;20;1;;
5962;12S Ultra;https://fdn2.gsmarena.com/vv/bigpic/xiaomi-12s-ultra.jpg;;Black, Dark Green;20;1;;
5963;12S Pro;https://fdn2.gsmarena.com/vv/bigpic/xiaomi-12s-pro.jpg;;Gray, White, Purple, Green;20;1;;
5964;12S;https://fdn2.gsmarena.com/vv/bigpic/xiaomi-12s.jpg;;Gray, White, Purple, Green;20;1;;
5965;12 Pro (Dimensity);https://fdn2.gsmarena.com/vv/bigpic/xiaomi-12-pro-dimensity.jpg;;Gray, Blue;20;1;;
5966;Poco F4;https://fdn2.gsmarena.com/vv/bigpic/xiaomi-poco-f4-5g-.jpg;;Moonlight Silver, Night Black, Nebula Green;20;1;;
5967;Poco X4 GT;https://fdn2.gsmarena.com/vv/bigpic/xiaomi-poco-x4-gt.jpg;;Black, Blue, Silver;20;1;;
5968;Poco C40;https://fdn2.gsmarena.com/vv/bigpic/xiaomi-poco-c40.jpg;;Power Black, Coral Green, Poco Yellow;20;1;;
5969;Redmi Note 11T Pro+;https://fdn2.gsmarena.com/vv/bigpic/xiaomi-redmi-note-11t-pro-plus.jpg;;Blue, Silver, Black;20;1;;
5970;Redmi Note 11T Pro;https://fdn2.gsmarena.com/vv/bigpic/xiaomi-redmi-note-11t-pro.jpg;;Blue, Silver, Black;20;1;;
5971;Redmi Note 11SE;https://fdn2.gsmarena.com/vv/bigpic/xiaomi-redmi-note-11se.jpg;;Blue, Black;20;1;;
5972;Redmi 10 Prime 2022;https://fdn2.gsmarena.com/vv/bigpic/xiaomi-redmi-10-.jpg;;Astral White, Bifrost Blue, Phantom Black;20;1;;
5973;Poco M4 5G (India);https://fdn2.gsmarena.com/vv/bigpic/xiaomi-poco-m4-5g.jpg;;Gray, Silver, Blue;20;1;;
5974;Poco F4 GT;https://fdn2.gsmarena.com/vv/bigpic/xiaomi-poco-f4-gt.jpg;;Stealth Black, Knight Silver, Cyber Yellow;20;1;;
5975;Poco Watch;https://fdn2.gsmarena.com/vv/bigpic/xiaomi-redmi-watch2.jpg;;Black, Blue, Ivory;20;3;;
5976;Civi 1S;https://fdn2.gsmarena.com/vv/bigpic/xiaomi-civi-1s.jpg;;Black, Blue, Pink, Silver;20;1;;
5977;Redmi 10 Power;https://fdn2.gsmarena.com/vv/bigpic/xiaomi-redmi-10-power-.jpg;;Sporty Orange, Power Black;20;1;;
5978;Black Shark 5 Pro;https://fdn2.gsmarena.com/vv/bigpic/xiaomi-black-shark-5-pro.jpg;;Black, White;20;1;;
5979;Black Shark 5;https://fdn2.gsmarena.com/vv/bigpic/xiaomi-black-shark-5-.jpg;;Black, White, Gray;20;1;;
5980;Black Shark 5 RS;https://fdn2.gsmarena.com/vv/bigpic/xiaomi-black-shark-5-rs.jpg;;Black, Yellow;20;1;;
5981;Redmi 10A;https://fdn2.gsmarena.com/vv/bigpic/xiaomi-redmi-10a.jpg;;Charcoal Black, Sea Blue, Slate Grey;20;1;;
5982;Redmi Note 11S 5G;https://fdn2.gsmarena.com/vv/bigpic/xiaomi-redmi-note-11s-5g.jpg;;Midnight Black, Twilight Blue, Star Blue;20;1;;
5983;Redmi 10 5G;https://fdn2.gsmarena.com/vv/bigpic/xiaomi-redmi-10-5g.jpg;;Graphite Gray, Chrome Silver, Aurora Green;20;1;;
5984;Redmi Note 11 Pro+ 5G;https://fdn2.gsmarena.com/vv/bigpic/xiaomi-redmi-note11-pro-plus-new.jpg;;Mysterious Black, Forest Green, Timeless Purple;20;1;;
5985;Redmi K50 Pro;https://fdn2.gsmarena.com/vv/bigpic/xiaomi-redmi-k50-pro.jpg;;Black, Gray, Blue, Green;20;1;;
5986;Redmi K50;https://fdn2.gsmarena.com/vv/bigpic/xiaomi-redmi-k50.jpg;;Black, Gray, Blue, Green;20;1;;
5987;Redmi K40S;https://fdn2.gsmarena.com/vv/bigpic/xiaomi-redmi-k40s.jpg;;Black, Gray, Blue, Green;20;1;;
5988;12 Pro;https://fdn2.gsmarena.com/vv/bigpic/xiaomi-12-pro.jpg;;Gray, Blue, Purple, Green;20;1;;
5989;12;https://fdn2.gsmarena.com/vv/bigpic/xiaomi-12.jpg;;Gray, Blue, Purple, Green;20;1;;
5990;12X;https://fdn2.gsmarena.com/vv/bigpic/xiaomi-12x.jpg;;Gray, Blue, Purple;20;1;;
5991;Watch S1 Active;https://fdn2.gsmarena.com/vv/bigpic/xiaomi-watch-s1-active.jpg;;Moon White, Space Black, Ocean Blue;20;3;;
5992;Redmi 10 (India);https://fdn2.gsmarena.com/vv/bigpic/xiaomi-redmi-10-india.jpg;;Midnight Black, Pacific Blue, Caribbean Green;20;1;;
5993;Redmi 10C;https://fdn2.gsmarena.com/vv/bigpic/xiaomi-redmi-10c.jpg;;Graphite Gray, Ocean Blue, Mint Green;20;1;;
5994;Redmi Note 11 Pro+ 5G (India);https://fdn2.gsmarena.com/vv/bigpic/xiaomi-note-11-pro-plus-5g.jpg;;Mirage Blue, Phantom White, Stealth Black;20;1;;
5995;Redmi Note 11E Pro;https://fdn2.gsmarena.com/vv/bigpic/xiaomi-redmi-note-11e-pro.jpg;;Graphite Gray, Polar White, Atlantic Blue;20;1;;
5996;Redmi Note 11E;https://fdn2.gsmarena.com/vv/bigpic/xiaomi-redmi-note-11e.jpg;;Gray, Silver, Atlantic Blue;20;1;;
5997;Poco X4 Pro 5G;https://fdn2.gsmarena.com/vv/bigpic/xiaomi-poco-x4-pro.jpg;;Laser Black, Laser Blue, Poco Yellow;20;1;;
5998;Poco M4 Pro;https://fdn2.gsmarena.com/vv/bigpic/xiaomi-poco-m4-pro.jpg;;Power Black, Cool Blue, Poco Yellow;20;1;;
5999;Redmi K50 Gaming;https://fdn2.gsmarena.com/vv/bigpic/xiaomi-redmi-k50-gaming.jpg;;Black, Gray, Blue, AMG;20;1;;
6000;Redmi 10 2022;https://fdn2.gsmarena.com/vv/bigpic/xiaomi-redmi-note-11-4g.jpg;;Carbon Gray, Pebble White, Sea Blue;20;1;;
6001;Redmi Note 11 Pro 5G;https://fdn2.gsmarena.com/vv/bigpic/xiaomi-redmi-note-11-pro-5g-global.jpg;;Graphite Gray, Polar White, Atlantic Blue;20;1;;
6002;Redmi Note 11 Pro;https://fdn2.gsmarena.com/vv/bigpic/xiaomi-redmi-note-11-pro-global.jpg;;Graphite Gray (Stealth Black), Polar White (Phantom White), Star Blue;20;1;;
6003;Redmi Note 11S;https://fdn2.gsmarena.com/vv/bigpic/xiaomi-redmi-note-11s-global.jpg;;Graphite Gray, Pearl White, Twilight Blue;20;1;;
6004;Redmi Note 11;https://fdn2.gsmarena.com/vv/bigpic/xiaomi-redmi-note-11-global.jpg;;Graphite Gray, Twilight Blue, Star Blue;20;1;;
6005;11i HyperCharge 5G;https://fdn2.gsmarena.com/vv/bigpic/xiaomi-11i-hypercharge.jpg;;Camo Green, Stealth Black, Purple Mist, Pacific Pearl;20;1;;
6006;11i;https://fdn2.gsmarena.com/vv/bigpic/xiaomi-11i.jpg;;Camo Green, Stealth Black, Purple Mist, Pacific Pearl;20;1;;
6007;Watch S1;https://fdn2.gsmarena.com/vv/bigpic/xiaomi-watch-s1.jpg;;Black, Silver;20;3;;
6008;Redmi Note 11T 5G;https://fdn2.gsmarena.com/vv/bigpic/xiaomi-redmi-note-11t-5g.jpg;;Aquamarine Blue, Stardust White, Matte Black;20;1;;
6009;Redmi Note 11 4G;https://fdn2.gsmarena.com/vv/bigpic/xiaomi-redmi-note-11-4g.jpg;;Carbon Gray, Pebble White, Sea Blue;20;1;;
6010;Poco M4 Pro 5G;https://fdn2.gsmarena.com/vv/bigpic/xiaomi-poco-m4-pro-5g.jpg;;Poco Yellow, Power Black, Cool Blue;20;1;;
6011;Redmi Note 11 Pro (China);https://fdn2.gsmarena.com/vv/bigpic/xiaomi-redmi-note11-pro.jpg;;Mysterious Black, Forest Green, Timeless Purple, Milky Way Blue;20;1;;
6012;Redmi Note 11 (China);https://fdn2.gsmarena.com/vv/bigpic/xiaomi-redmi-note11.jpg;;Mysterious Black, Milky Way Blue, Mint Green;20;1;;
6013;Redmi Watch 2 Lite;https://fdn2.gsmarena.com/vv/bigpic/xiaomi-redmi-watch2-lite.jpg;;Black, Blue, Ivory;20;3;;
6014;Redmi Watch 2;https://fdn2.gsmarena.com/vv/bigpic/xiaomi-redmi-watch2.jpg;;Black, Blue, Ivory;20;3;;
6015;Black Shark 4S Pro;https://fdn2.gsmarena.com/vv/bigpic/xiaomi-black-shark-4s-pro.jpg;;Black, White;20;1;;
6016;Black Shark 4S;https://fdn2.gsmarena.com/vv/bigpic/xiaomi-black-shark-4s.jpg;;Black, White;20;1;;
6017;Redmi Note 10 Lite;https://fdn2.gsmarena.com/vv/bigpic/xiaomi-redmi-note-10-lite.jpg;;Aurora Blue, Glacier White, Interstellar Black, Champagne Gold;20;1;;
6018;Civi;https://fdn2.gsmarena.com/vv/bigpic/xiaomi-civi.jpg;;Black, Blue, Pink;20;1;;
6019;Watch Color 2;https://fdn2.gsmarena.com/vv/bigpic/xiaomi-watch-color2.jpg;;Black, Silver, Blue;20;3;;
6020;Redmi 9i Sport;https://fdn2.gsmarena.com/vv/bigpic/xiaomi-redmi-9i-sport.jpg;;Carbon Black, Coral Green, Metallic Blue;20;1;;
6021;Redmi 9A Sport;https://fdn2.gsmarena.com/vv/bigpic/xiaomi-redmi-9a-sport.jpg;;Carbon Black, Coral Green, Metallic Blue;20;1;;
6022;Poco C31;https://fdn2.gsmarena.com/vv/bigpic/xiaomi-poco-c31.jpg;;Royal Blue, Shadow Gray;20;1;;
6023;Redmi 9 Activ;https://fdn2.gsmarena.com/vv/bigpic/xiaomi-redmi-9-activ.jpg;;Carbon Black, Coral Green, Metallic Purple;20;1;;
6024;11T Pro;https://fdn2.gsmarena.com/vv/bigpic/xiaomi-11t-pro.jpg;;Meteorite Gray, Moonlight White, Celestial Blue;20;1;;
6025;11T;https://fdn2.gsmarena.com/vv/bigpic/xiaomi-11t.jpg;;Meteorite Gray, Moonlight White, Celestial Blue;20;1;;
6026;11 Lite 5G NE;https://fdn2.gsmarena.com/vv/bigpic/xiaomi-11-lite-5g-ne.jpg;;Truffle Black (Vinyl Black), Bubblegum Blue (Jazz Blue), Peach Pink (Tuscany Coral), Snowflake White (Diamond Dazzle);20;1;;
6027;Redmi 10 Prime;https://fdn2.gsmarena.com/vv/bigpic/xiaomi-redmi-10-.jpg;;Astral White, Bifrost Blue, Phantom Black;20;1;;
6028;Redmi 10;https://fdn2.gsmarena.com/vv/bigpic/xiaomi-redmi-10-.jpg;;Carbon Gray, Pebble White, Sea Blue;20;1;;
6029;Pad 5 Pro;https://fdn2.gsmarena.com/vv/bigpic/xiaomi-pad-5-pro.jpg;;Black, White;20;2;;
6030;Pad 5;https://fdn2.gsmarena.com/vv/bigpic/xiaomi-pad-5.jpg;;Cosmic Gray, Pearl White, Green;20;2;;
6031;Mix 4;https://fdn2.gsmarena.com/vv/bigpic/xiaomi-mi-mix-4.jpg;;Ceramic Black, Ceramic White, Shadow Gray;20;1;;
6032;Poco X3 GT;https://fdn2.gsmarena.com/vv/bigpic/xiaomi-redmi-note-10-pro-china-new.jpg;;Stargaze Black, Wave Blue, Cloud White;20;1;;
6033;Poco F3 GT;https://fdn2.gsmarena.com/vv/bigpic/xiaomi-poco-f3-gt.jpg;;Predator Black, Gunmetal Silver;20;1;;
6034;Redmi Note 10T 5G;https://fdn2.gsmarena.com/vv/bigpic/xiaomi-redmi-note-10t-5g.jpg;;Metallic Blue, Mint Green, Chromium White, Graphite Black;20;1;;
6035;Mi Watch Revolve Active;https://fdn2.gsmarena.com/vv/bigpic/xiaomi-mi-watch-revolve-active.jpg;;Black, Navy Blue, Beige;20;3;;
6036;Redmi Note 10 Pro (China);https://fdn2.gsmarena.com/vv/bigpic/xiaomi-redmi-note-10-pro-china-new.jpg;;Stargaze Black, Wave Blue, Cloud White;20;1;;
6037;Redmi Note 8 2021;https://fdn2.gsmarena.com/vv/bigpic/xiaomi-redmi-note8-2021.jpg;;Neptune Blue, Moonlight White, Space Black;20;1;;
6038;Poco M3 Pro 5G;https://fdn2.gsmarena.com/vv/bigpic/xiaomi-poco-m3-pro-5g.jpg;;Poco Yellow, Power Black, Cool Blue;20;1;;
6039;Redmi K40 Gaming;https://fdn2.gsmarena.com/vv/bigpic/xiaomi-redmi-k40-gaming.jpg;;Black, Gray, Silver, Bruce Lee Yellow;20;1;;
6040;Mi 11X Pro;https://fdn2.gsmarena.com/vv/bigpic/xiaomi-mi11x-pro.jpg;;Celestial Silver, Lunar White, Cosmic Black;20;1;;
6041;Mi 11X;https://fdn2.gsmarena.com/vv/bigpic/xiaomi-mi11x.jpg;;Celestial Silver, Lunar White, Cosmic Black;20;1;;
6042;Poco M2 Reloaded;https://fdn2.gsmarena.com/vv/bigpic/xiaomi-poco-m2-reloaded.jpg;;Pitch Black (Greyish Black), Slate Blue (Mostly Blue);20;1;;
6043;Mi Mix Fold;https://fdn2.gsmarena.com/vv/bigpic/xiaomi-mi-mix-fold.jpg;;Black, Ceramic;20;1;;
6044;Mi 11 Ultra;https://fdn2.gsmarena.com/vv/bigpic/xiaomi-mi11-ultra-5g-k1.jpg;;Ceramic White (Cosmic White), Ceramic Black (Cosmic Black);20;1;;
6045;Mi 11 Pro;https://fdn2.gsmarena.com/vv/bigpic/xiaomi-mi-11-pro-5g.jpg;;Black, Green, Purple;20;1;;
6046;Mi 11i;https://fdn2.gsmarena.com/vv/bigpic/xiaomi-mi-11i-5g.jpg;;Celestial Silver, Frosty White, Cosmic Black;20;1;;
6047;Mi 11 Lite 5G;https://fdn2.gsmarena.com/vv/bigpic/xiaomi-mi-11-lite-5g.jpg;;Truffle Black, Mint Green, Citrus Yellow;20;1;;
6048;Mi 11 Lite;https://fdn2.gsmarena.com/vv/bigpic/xiaomi-mi-11-lite-4g.jpg;;Boba Black (Vinyl Black), Peach Pink (Tuscany Coral), Bubblegum Blue (Jazz Blue);20;1;;
6049;Black Shark 4 Pro;https://fdn2.gsmarena.com/vv/bigpic/xiaomi-black-shark-4-pro.jpg;;Shadow Black, Misty Grey, Cosmos Black, Dark Blue, Silver;20;1;;
6050;Black Shark 4;https://fdn2.gsmarena.com/vv/bigpic/xiaomi-black-shark-4.jpg;;Mirror Black, Pale Grey, Black, Blue, Silver;20;1;;
6051;Poco X3 Pro;https://fdn2.gsmarena.com/vv/bigpic/xiaomi-poco-x3-pro-.jpg;;Phantom Black, Frost Blue, Metal Bronze;20;1;;
6052;Poco F3;https://fdn2.gsmarena.com/vv/bigpic/xiaomi-poco-f3.jpg;;Arctic White, Night Black, Deep Ocean Blue, Moonlight Silver;20;1;;
6053;Mi 10S;https://fdn2.gsmarena.com/vv/bigpic/xiaomi-mi-10s.jpg;;Titanium Black, Ice Blue, Pearl White;20;1;;
6054;Redmi Note 10 Pro;https://fdn2.gsmarena.com/vv/bigpic/xiaomi-redmi-note10-pro.jpg;;Onyx Gray, Glacier Blue, Gradient Bronze;20;1;;
6055;Redmi Note 10 5G;https://fdn2.gsmarena.com/vv/bigpic/xiaomi-redmi-note10-5g.jpg;;Chrome Silver, Graphite Gray, Nighttime Blue, Aurora Green;20;1;;
6056;Redmi Note 10S;https://fdn2.gsmarena.com/vv/bigpic/xiaomi-redmi-note10s.jpg;;Deep Sea Blue (Ocean Blue), Shadow Black (Onyx Gray), (Frost White) Pebble White;20;1;;
6057;Redmi Note 10;https://fdn2.gsmarena.com/vv/bigpic/xiaomi-redmi-note10--.jpg;;Shadow Black (Onyx Gray), Frost White (Pebble White), Aqua Green (Lake Green);20;1;;
6058;Redmi Note 10 Pro Max;https://fdn2.gsmarena.com/vv/bigpic/xiaomi-redmi-note10-pro-india.jpg;;Dark Night, Glacial Blue, Vintage Bronze;20;1;;
6059;Redmi Note 10 Pro (India);https://fdn2.gsmarena.com/vv/bigpic/xiaomi-redmi-note10-pro-india.jpg;;Vintage Bronze, Glacial Blue, Dark Night;20;1;;
6060;Redmi K40 Pro+;https://fdn2.gsmarena.com/vv/bigpic/xiaomi-redmi-k40-pro-plus.jpg;;Black, White, Aurora;20;1;;
6061;Redmi K40 Pro;https://fdn2.gsmarena.com/vv/bigpic/xiaomi-redmi-k40-pro.jpg;;Black, White, Aurora;20;1;;
6062;Redmi K40;https://fdn2.gsmarena.com/vv/bigpic/xiaomi-redmi-k40.jpg;;Black, White, Aurora;20;1;;
6063;Redmi Note 9T;https://fdn2.gsmarena.com/vv/bigpic/xiaomi-redmi-note-9t-5g.jpg;;Nightfall Black, Daybreak Purple;20;1;;
6064;Redmi 9T;https://fdn2.gsmarena.com/vv/bigpic/xiaomi-redmi-9-power.jpg;;Carbon Gray, Twilight Blue, Sunrise Orange, Ocean Green;20;1;;
6065;Mi 10i 5G;https://fdn2.gsmarena.com/vv/bigpic/xiaomi-mi-10i-5g.jpg;;Pacific Sunrise, Midnight Black, Atlantic Blue;20;1;;
6066;Mi 11;https://fdn2.gsmarena.com/vv/bigpic/xiaomi-mi11.jpg;;Horizon Blue, Cloud White, Midnight Gray, Special Edition Blue, Gold, Violet;20;1;;
6067;Redmi 9 Power;https://fdn2.gsmarena.com/vv/bigpic/xiaomi-redmi-9-power.jpg;;Mighty Black, Fiery Red, Electric Green, Blazing Blue;20;1;;
6068;Mi Watch Lite;https://fdn2.gsmarena.com/vv/bigpic/xiaomi-redmi-watch.jpg;;Black, Blue, Ivory;20;3;;
6069;Redmi Note 9 Pro 5G;https://fdn2.gsmarena.com/vv/bigpic/xiaomi-redmi-note9-pro.jpg;;Gray, Blue, Red/Mint;20;1;;
6070;Redmi Note 9 5G;https://fdn2.gsmarena.com/vv/bigpic/xiaomi-redmi-note-9-5g.jpg;;Gray, Green, Violet;20;1;;
6071;Redmi Note 9 4G;https://fdn2.gsmarena.com/vv/bigpic/xiaomi-redmi-note9-4g.jpg;;Gray, Green, Blue, Orange;20;1;;
6072;Redmi Watch;https://fdn2.gsmarena.com/vv/bigpic/xiaomi-redmi-watch.jpg;;Black, Blue, Ivory;20;3;;
6073;Poco M3;https://fdn2.gsmarena.com/vv/bigpic/xiaomi-poco-m3-.jpg;;Cool Blue, Poco Yellow, Power Black;20;1;;
6074;Redmi K30S;https://fdn2.gsmarena.com/vv/bigpic/xiaomi-mi-10t-5g-.jpg;;Cosmic Black, Lunar Silver;20;1;;
6075;Mi Watch Color Sports;https://fdn2.gsmarena.com/vv/bigpic/xiaomi-mi-watch-color-sports-edition.jpg;;Black, Blue, Ivory;20;3;;
6076;Poco C3;https://fdn2.gsmarena.com/vv/bigpic/xiaomi-poco-c3.jpg;;Arctic Blue, Lime Green, Matte Black;20;1;;
6077;Mi 10T Pro 5G;https://fdn2.gsmarena.com/vv/bigpic/xiaomi-mi-10t-5g-pro.jpg;;Cosmic Black, Lunar Silver, Aurora Blue;20;1;;
6078;Mi 10T 5G;https://fdn2.gsmarena.com/vv/bigpic/xiaomi-mi-10t-5g-.jpg;;Cosmic Black, Lunar Silver;20;1;;
6079;Mi 10T Lite 5G;https://fdn2.gsmarena.com/vv/bigpic/xiaomi-mi-10t-lite-.jpg;;Atlantic Blue, Pearl Gray, Rose Gold Beach;20;1;;
6080;Mi Watch;https://fdn2.gsmarena.com/vv/bigpic/xiaomi-mi-watch.jpg;;Elegant Black, Fashion Silver, Navy Blue, Beige;20;3;;
6081;Mi Watch Revolve;https://fdn2.gsmarena.com/vv/bigpic/xiaomi-mi-watch-revolve.jpg;;Midnight Black, Chrome Silver;20;3;;
6082;Redmi 9AT;https://fdn2.gsmarena.com/vv/bigpic/xiaomi-redmi-9a-1.jpg;;Carbon Gray, Sky Blue, Ocean Green;20;1;;
6083;Redmi 9i;https://fdn2.gsmarena.com/vv/bigpic/xiaomi-redmi-9a-1.jpg;;Midnight Black, Sea Blue, Nature Green;20;1;;
6084;Poco M2;https://fdn2.gsmarena.com/vv/bigpic/xiaomi-poco-m2-mzb9921in.jpg;;Brick Red, Pitch Black, Slate Blue;20;1;;
6085;Poco X3;https://fdn2.gsmarena.com/vv/bigpic/xiaomi-poco-x3.jpg;;Cobalt Blue, Shadow Gray;20;1;;
6086;Poco X3 NFC;https://fdn2.gsmarena.com/vv/bigpic/xiaomi-poco-x3-nfc.jpg;;Cobalt Blue, Shadow Gray;20;1;;
6087;Redmi 9 (India);https://fdn2.gsmarena.com/vv/bigpic/xiaomi-redmi-9-india.jpg;;Black, Sky Blue, Sporty Orange;20;1;;
6088;Mi 10 Ultra;https://fdn2.gsmarena.com/vv/bigpic/xiaomi-mi10-ultra.jpg;;Obsidian Black, Mercury Silver, Transparent Edition;20;1;;
6089;Redmi K30 Ultra;https://fdn2.gsmarena.com/vv/bigpic/xiaomi-redmi-k30-ultra.jpg;;Moonlight White, Midnight Black, Mint Green;20;1;;
6090;Redmi 9 Prime;https://fdn2.gsmarena.com/vv/bigpic/xiaomi-redmi-9.jpg;;Space Blue, Mint Green, Matte Black, Sunrise Flare;20;1;;
6091;Black Shark 3S;https://fdn2.gsmarena.com/vv/bigpic/xiaomi-black-shark-3s.jpg;;Sky Cloud Black, Crystal Blue;20;1;;
6092;Poco M2 Pro;https://fdn2.gsmarena.com/vv/bigpic/poco-m2-pro.jpg;;Out Of The Blue, Green and Greener, Two Shades of Black;20;1;;
6093;Redmi 9A;https://fdn2.gsmarena.com/vv/bigpic/xiaomi-redmi-9a-1.jpg;;Carbon Gray (Midnight Black), Sky Blue (Sea Blue), Ocean Green (Nature Green);20;1;;
6094;Redmi 9C NFC;https://fdn2.gsmarena.com/vv/bigpic/xiaomi-redmi-9c-.jpg;;Midnight Gray, Sunshine Yellow, Twilight Blue;20;1;;
6095;Redmi 9C;https://fdn2.gsmarena.com/vv/bigpic/xiaomi-redmi-9c-.jpg;;Midnight Gray, Sunrise Orange, Twilight Blue;20;1;;
6096;Redmi 9;https://fdn2.gsmarena.com/vv/bigpic/xiaomi-redmi-9.jpg;;Carbon Gray, Sunset Purple, Ocean Green, Pink/Blue;20;1;;
6097;Redmi 10X Pro 5G;https://fdn2.gsmarena.com/vv/bigpic/xiaomi-redmi-10x-pro-5g.jpg;;Blue, Gold, Pink/Blue;20;1;;
6098;Redmi 10X 5G;https://fdn2.gsmarena.com/vv/bigpic/xiaomi-redmi-10x-5g.jpg;;Blue, Gold, Pink/Blue;20;1;;
6099;Redmi 10X 4G;https://fdn2.gsmarena.com/vv/bigpic/xiaomi-redmi-10x-4g.jpg;;Blue, Green, White;20;1;;
6100;Redmi K30i 5G;https://fdn2.gsmarena.com/vv/bigpic/xiaomi-redmi-k30i-5g-.jpg;;Blue, White, Red, Purple;20;1;;
6101;Poco F2 Pro;https://fdn2.gsmarena.com/vv/bigpic/xiaomi-poco-f2-pro.jpg;;Neon Blue, Phantom White, Electric Purple, Cyber Gray;20;1;;
6102;Redmi K30 5G Racing;https://fdn2.gsmarena.com/vv/bigpic/xiaomi-redmi-k30-5g-racing-edition1.jpg;;Mint, Blue, Red, Purple, White;20;1;;
6103;Redmi Note 9 Pro;https://fdn2.gsmarena.com/vv/bigpic/xiaomi-redmi-note-9-pro-global-.jpg;;Tropical Green, Glacier White, Interstellar Gray;20;1;;
6104;Redmi Note 9;https://fdn2.gsmarena.com/vv/bigpic/xiaomi-redmi-note-9.jpg;;Forest Green, Midnight Grey, Polar White;20;1;;
6105;Mi Note 10 Lite;https://fdn2.gsmarena.com/vv/bigpic/xiaomi-mi-note-10-lite-.jpg;;Midnight Black, Glacier White, Nebula Purple;20;1;;
6106;Mi 10 Youth 5G;https://fdn2.gsmarena.com/vv/bigpic/xiaomi-mi-10-youth-5g-.jpg;;Blue, White, Black, Green, Orange/Peach;20;1;;
6107;Mi 10 Lite 5G;https://fdn2.gsmarena.com/vv/bigpic/xiaomi-mi10-lite-5g.jpg;;Aurora Blue, Cosmic Gray, Dream White;20;1;;
6108;Redmi K30 Pro Zoom;https://fdn2.gsmarena.com/vv/bigpic/xiaomi-redmi-k30-pro-zoom.jpg;;Grey, Purple, White, Blue;20;1;;
6109;Redmi K30 Pro;https://fdn2.gsmarena.com/vv/bigpic/xiaomi-redmi-k30-pro.jpg;;Neon Blue, Phantom White, Electric Purple, Cyber Gray;20;1;;
