id;name;image;code;colors;brand_id;repair_category_id;status;sort_order
6110;Redmi Note 9S;https://fdn2.gsmarena.com/vv/bigpic/xiaomi-redmi-note-9-pro.jpg;;Aurora Blue, Glacier White, Interstellar Gray;20;1;;
6111;Redmi Note 9 Pro Max;https://fdn2.gsmarena.com/vv/bigpic/xiaomi-redmi-note-9-pro-max.jpg;;Aurora Blue, Glacier White, Interstellar Black;20;1;;
6112;Redmi Note 9 Pro (India);https://fdn2.gsmarena.com/vv/bigpic/xiaomi-redmi-note-9-pro.jpg;;Aurora Blue, Glacier White, Interstellar Black;20;1;;
6113;Black Shark 3 Pro;https://fdn2.gsmarena.com/vv/bigpic/xiaomi-black-shark-3-pro.jpg;;Phantom Black, Armor Gray;20;1;;
6114;Black Shark 3;https://fdn2.gsmarena.com/vv/bigpic/xiaomi-black-shark-3.jpg;;Lightning Black, Armor Gray, Star Silver;20;1;;
6115;Mi 10 Pro 5G;https://fdn2.gsmarena.com/vv/bigpic/xiaomi-mi-10-pro-5g.jpg;;Alpine White, Solstice Grey;20;1;;
6116;Mi 10 5G;https://fdn2.gsmarena.com/vv/bigpic/xiaomi-mi-10-5g.jpg;;Coral Green, Twilight Grey, Peach Gold;20;1;;
6117;Redmi 8A Pro;https://fdn2.gsmarena.com/vv/bigpic/xiaomi-redmi-8a-dual.jpg;;Sky White, Sea Blue, Midnight Grey;20;1;;
6118;Redmi 8A Dual;https://fdn2.gsmarena.com/vv/bigpic/xiaomi-redmi-8a-dual.jpg;;Sky White, Sea Blue, Midnight Grey;20;1;;
6119;Poco X2;https://fdn2.gsmarena.com/vv/bigpic/xiaomi-poco-x2.jpg;;Atlantis Blue, Matrix Purple, Phoenix Red;20;1;;
6120;Redmi K30;https://fdn2.gsmarena.com/vv/bigpic/xiaomi-redmi-k30.jpg;;Blue, Red, Purple;20;1;;
6121;Redmi K30 5G;https://fdn2.gsmarena.com/vv/bigpic/xiaomi-redmi-k30-5g.jpg;;Blue, Red, Purple, White;20;1;;
6122;Redmi Note 8T;https://fdn2.gsmarena.com/vv/bigpic/xiaomi-redmi-note-8t.jpg;;Starscape Blue, Moonlight White, Moonshadow Grey;20;1;;
6123;Mi Note 10 Pro;https://fdn2.gsmarena.com/vv/bigpic/xiaomi-mi-note10-.jpg;;Aurora Green, Glacier White, Midnight Black;20;1;;
6124;Mi Note 10;https://fdn2.gsmarena.com/vv/bigpic/xiaomi-mi-note10-.jpg;;Aurora Green, Glacier White, Midnight Black;20;1;;
6125;Mi CC9 Pro;https://fdn2.gsmarena.com/vv/bigpic/xiaomi-mi-cc9-pro-.jpg;;Aurora Green, Glacier White, Midnight Black;20;1;;
6126;Watch Color;https://fdn2.gsmarena.com/vv/bigpic/xiaomi-watch-color-.jpg;;Black, Silver, Keith Haring;20;3;;
6127;Mi Watch (China);https://fdn2.gsmarena.com/vv/bigpic/xiaomi-mi-watch-.jpg;;Black, Silver;20;3;;
6128;Redmi 8;https://fdn2.gsmarena.com/vv/bigpic/xiaomi-redmi-8.jpg;;Onyx Black, Ruby Red, Sapphire Blue, Phantom Red;20;1;;
6129;Redmi 8A;https://fdn2.gsmarena.com/vv/bigpic/xiaomi-redmi-8a.jpg;;Midnight Black, Ocean Blue, Sunset Red;20;1;;
6130;Mi Mix Alpha;https://fdn2.gsmarena.com/vv/bigpic/xiaomi-mi-mix-alpha.jpg;;Black;20;1;;
6131;Mi 9 Pro 5G;https://fdn2.gsmarena.com/vv/bigpic/xiaomi-mi-9-pro-5g.jpg;;Dream White, Titanium Black;20;1;;
6132;Mi 9 Pro;https://fdn2.gsmarena.com/vv/bigpic/xiaomi-mi-9-pro.jpg;;Dream White, Titanium Black;20;1;;
6133;Redmi K20 Pro Premium;https://fdn2.gsmarena.com/vv/bigpic/xiaomi-redmi-k20pro-.jpg;;Carbon black, Flame red, Glacier blue, Summer Honey, Pearl White;20;1;;
6134;Mi 9 Lite;https://fdn2.gsmarena.com/vv/bigpic/xiaomi-mi-cc9-.jpg;;Pearl White, Aurora Blue, Onyx Grey;20;1;;
6135;Redmi Note 8 Pro;https://fdn2.gsmarena.com/vv/bigpic/xiaomi-redmi-note-8-pro-.jpg;;Black, Red, Blue, White, Deep Sea Blue, Midnight Blue, Electric Blue, Twilight Orange;20;1;;
6136;Black Shark 2 Pro;https://fdn2.gsmarena.com/vv/bigpic/xiaomi-black-shark2-pro-.jpg;;Shadow Black, Iceberg Grey, Gulf Blue, Streamer Purple;20;1;;
6137;Mi A3;https://fdn2.gsmarena.com/vv/bigpic/xiaomi-mi-a3.jpg;;Kind of Gray, Not just Blue, More than White;20;1;;
6138;Redmi 7A;https://fdn2.gsmarena.com/vv/bigpic/xiaomi-redmi-7a-mzb8008in.jpg;;Matte Black, Morning blue, Matte Blue, Matte Gold, Gem Red, Gem Blue;20;1;;
6139;Mi CC9e;https://fdn2.gsmarena.com/vv/bigpic/xiaomi-mi-cc9e-.jpg;;Black, Blue, White;20;1;;
6140;Mi CC9;https://fdn2.gsmarena.com/vv/bigpic/xiaomi-mi-cc9-.jpg;;Black, Blue, White;20;1;;
6141;Redmi Note 8;https://fdn2.gsmarena.com/vv/bigpic/xiaomi-redmi-note-8-1.jpg;;Neptune Blue, Moonlight White, Space Black, Nebula Purple, Cosmic Purple;20;1;;
6142;Mi 9T Pro;https://fdn2.gsmarena.com/vv/bigpic/xiaomi-mi-9t.jpg;;Carbon black, Red flame, Glacier blue;20;1;;
6143;Mi 9T;https://fdn2.gsmarena.com/vv/bigpic/xiaomi-mi-9t.jpg;;Carbon black, Red flame, Glacier blue;20;1;;
6144;Redmi K20;https://fdn2.gsmarena.com/vv/bigpic/xiaomi-redmi-k20pro-.jpg;;Carbon black, Red flame, Glacier blue, Pearl White;20;1;;
6145;Redmi K20 Pro;https://fdn2.gsmarena.com/vv/bigpic/xiaomi-redmi-k20pro-.jpg;;Carbon black, Flame red, Glacier blue, Summer Honey, Pearl White;20;1;;
6146;Redmi Note 7S;https://fdn2.gsmarena.com/vv/bigpic/xiaomi-redmi-note-7s.jpg;;Onyx Black, Sapphire Blue, Ruby Red, Astro White;20;1;;
6147;Redmi Y3;https://fdn2.gsmarena.com/vv/bigpic/xiaomi-redmi-y3.jpg;;Elegant Blue, Bold Red, Prime Black;20;1;;
6148;Black Shark 2;https://fdn2.gsmarena.com/vv/bigpic/xiaomi-black-shark-2.jpg;;Black, Silver, Blue;20;1;;
6149;Redmi 7;https://fdn2.gsmarena.com/vv/bigpic/xiaomi-redmi-7.jpg;;Lunar Red, Eclipse Black, Comet Blue;20;1;;
6150;Redmi Note 7 Pro;https://fdn2.gsmarena.com/vv/bigpic/xiaomi-redmi-note-7-pro.jpg;;Nebula Red, Neptune Blue, Space Black, Astro White;20;1;;
6151;Mi Mix 3 5G;https://fdn2.gsmarena.com/vv/bigpic/xiaomi-mi-mix3.jpg;;Sapphire Blue;20;1;;
6152;Mi 9 Explorer;https://fdn2.gsmarena.com/vv/bigpic/xiaomi-mi-9-explore.jpg;;Transparent Black;20;1;;
6153;Mi 9 SE;https://fdn2.gsmarena.com/vv/bigpic/xiaomi-mi-9-se.jpg;;Violet, Blue, Gray;20;1;;
6154;Mi 9;https://fdn2.gsmarena.com/vv/bigpic/xiaomi-mi-9-.jpg;;Lavender Violet, Ocean Blue, Piano Black;20;1;;
6155;Redmi Go;https://fdn2.gsmarena.com/vv/bigpic/xiaomi-redmi-go.jpg;;Black, Blue;20;1;;
6156;Redmi Note 7;https://fdn2.gsmarena.com/vv/bigpic/xiaomi-redmi-note-7.jpg;;Blue, Black, Twilight Gold, White;20;1;;
6157;Mi Play;https://fdn2.gsmarena.com/vv/bigpic/xiaomi-miplay.jpg;;Dream Blue, Twilight Gold, Black;20;1;;
6158;Black Shark Helo;https://fdn2.gsmarena.com/vv/bigpic/xiaomi-black-shark2.jpg;;Black;20;1;;
6159;Mi Mix 3;https://fdn2.gsmarena.com/vv/bigpic/xiaomi-mi-mix3.jpg;;Jade Green, Sapphire Blue, Onyx Black, Forbidden City Blue;20;1;;
6160;Redmi Note 6 Pro;https://fdn2.gsmarena.com/vv/bigpic/xiaomi-redmi-note-6-pro-r.jpg;;Black, Blue, Rose Gold, Red;20;1;;
6161;Mi 8 Pro;https://fdn2.gsmarena.com/vv/bigpic/xiaomi-mi-8-pro-.jpg;;Transparent Black, Meteorite Black, Twilight Gold;20;1;;
6162;Mi 8 Lite;https://fdn2.gsmarena.com/vv/bigpic/xiaomi-mi-8-lite-.jpg;;Midnight Black, Aurora Blue, Twilight Gold;20;1;;
6163;Pocophone F1;https://fdn2.gsmarena.com/vv/bigpic/xiaomi-pocophone-f1-.jpg;;Graphite Black, Steel Blue, Rosso Red, Armored Edition with Kevlar;20;1;;
6164;Mi A2 (Mi 6X);https://fdn2.gsmarena.com/vv/bigpic/xiaomi-mi-a2-.jpg;;Black, Gold, Blue, Red, Rose Gold;20;1;;
6165;Mi A2 Lite (Redmi 6 Pro);https://fdn2.gsmarena.com/vv/bigpic/xiaomi-mi-a2-lite.jpg;;Black, Blue, Gold, Rose Gold, Red;20;1;;
6166;Mi Max 3;https://fdn2.gsmarena.com/vv/bigpic/xiaomi-mi-max3-.jpg;;Black, Champagne Gold, Blue;20;1;;
6167;Mi Pad 4 Plus;https://fdn2.gsmarena.com/vv/bigpic/xiaomi-mi-pad-4-plus.jpg;;Black, Rose Gold;20;2;;
6168;Mi Pad 4;https://fdn2.gsmarena.com/vv/bigpic/xiaomi-mi-pad-4.jpg;;Black, Rose Gold;20;2;;
6169;Redmi 6;https://fdn2.gsmarena.com/vv/bigpic/xiaomi-redmi-6.jpg;;Black, Grey, Blue, Gold, Rose Gold;20;1;;
6170;Redmi 6A;https://fdn2.gsmarena.com/vv/bigpic/xiaomi-redmi-6a.jpg;;Black, Grey, Blue, Gold, Rose Gold;20;1;;
6171;Mi 8 Explorer;https://fdn2.gsmarena.com/vv/bigpic/xiaomi-mi8-explore-.jpg;;Black (transparent back);20;1;;
6172;Mi 8;https://fdn2.gsmarena.com/vv/bigpic/xiaomi-mi8.jpg;;Black, Blue, White, Gold;20;1;;
6173;Mi 8 SE;https://fdn2.gsmarena.com/vv/bigpic/xiaomi-mi8-se.jpg;;Gray, Blue, Red, Gold;20;1;;
6174;Redmi S2 (Redmi Y2);https://fdn2.gsmarena.com/vv/bigpic/xiaomi-redmi-s2-.jpg;;Gray, Gold, Rose Gold, Mesmerising Blue, Stunning Black;20;1;;
6175;Mi Mix 2S;https://fdn2.gsmarena.com/vv/bigpic/xiaomi-mi-mix-2s.jpg;;Black, White;20;1;;
6176;Redmi Note 5 AI Dual Camera;https://fdn2.gsmarena.com/vv/bigpic/xiaomi-redmi-note-5-ai-dual-camera.jpg;;Black, Gold, Rose Gold, Blue, Flame Red;20;1;;
6177;Redmi Note 5 Pro;https://fdn2.gsmarena.com/vv/bigpic/xiaomi-redmi-note-5-pro.jpg;;Black, Champagne Gold, Rose Gold, Lake Blue;20;1;;
6178;Black Shark;https://fdn2.gsmarena.com/vv/bigpic/xiaomi-black-shark.jpg;;Black, Gray, Royal Blue;20;1;;
6179;Redmi 5 Plus (Redmi Note 5);https://fdn2.gsmarena.com/vv/bigpic/xiaomi-redmi-5-plus.jpg;;Black, Gold, Blue, Rose Gold;20;1;;
6180;Redmi 5;https://fdn2.gsmarena.com/vv/bigpic/xiaomi-redmi-5.jpg;;Black, Gold, Light Blue, Rose Gold;20;1;;
6181;Redmi 5A;https://fdn2.gsmarena.com/vv/bigpic/xiaomi-redmi-5a.jpg;;Gold, Dark Gray, Rose Gold, Blue;20;1;;
6182;Redmi Y1 (Note 5A);https://fdn2.gsmarena.com/vv/bigpic/xiaomi-redmi-note-5a.jpg;;Gold, Dark Grey, Silver, Rose Gold;20;1;;
6183;Redmi Y1 Lite;https://fdn2.gsmarena.com/vv/bigpic/xiaomi-redmi-note-5as.jpg;;Gold, Dark Grey, Silver, Rose Gold;20;1;;
6184;Mi Note 3;https://fdn2.gsmarena.com/vv/bigpic/xiaomi-mi-note3-.jpg;;Black, Blue;20;1;;
6185;Mi Mix 2;https://fdn2.gsmarena.com/vv/bigpic/xiaomi-mi-mix2-new.jpg;;Black, White;20;1;;
6186;Mi A1 (Mi 5X);https://fdn2.gsmarena.com/vv/bigpic/xiaomi-mi-a1.jpg;;Black, Gold, Rose Gold, Red;20;1;;
6187;Mi Max 2;https://fdn2.gsmarena.com/vv/bigpic/xiaomi-mi-max2.jpg;;Gold, Matte Black;20;1;;
6188;Redmi 4 (4X);https://fdn2.gsmarena.com/vv/bigpic/xiaomi-redmi-4x.jpg;;Black, Gold;20;1;;
6189;Mi 6;https://fdn2.gsmarena.com/vv/bigpic/xiaomi-mi-6.jpg;;Ceramic Black, Black, Blue, White;20;1;;
6190;Mi Pad 3;https://fdn2.gsmarena.com/vv/bigpic/xiaomi-mi-pad-3-1.jpg;;Champagne Gold;20;2;;
6191;Mi 5c;https://fdn2.gsmarena.com/vv/bigpic/xiaomi-mi-5c.jpg;;Black, Gold, Rose Gold;20;1;;
6192;Redmi Note 4X;https://fdn2.gsmarena.com/vv/bigpic/xiaomi-redmi-note-4x.jpg;;Platinum Silver, Champagne Gold, Matte Black, Hatsune Miku, Sakura Powder;20;1;;
6193;Redmi Note 4;https://fdn2.gsmarena.com/vv/bigpic/xiaomi-redmi-note-4-sn.jpg;;Dark Gray, Gold, Black, Lake Blue;20;1;;
6194;Redmi 4A;https://fdn2.gsmarena.com/vv/bigpic/xiaomi-redmi-4a-.jpg;;Gold, Rose Gold, Dark Gray;20;1;;
6195;Redmi 4 (China);https://fdn2.gsmarena.com/vv/bigpic/xiaomi-redmi-4-prime-.jpg;;Gold, Dark Gray, Silver;20;1;;
6196;Mi 6 Plus;https://fdn2.gsmarena.com/vv/bigpic/xiaomi-mi-6-plus.jpg;;Silver, Gray, Gold, Rose Gold;20;1;;
6197;Redmi 4 Prime;https://fdn2.gsmarena.com/vv/bigpic/xiaomi-redmi-4-prime-new.jpg;;Gold, Dark Gray, Silver;20;1;;
6198;Mi Mix;https://fdn2.gsmarena.com/vv/bigpic/xiaomi-mix-.jpg;;Black, White;20;1;;
6199;Mi Note 2;https://fdn2.gsmarena.com/vv/bigpic/xiaomi-mi-note2-.jpg;;Black, Gold, Silver;20;1;;
6200;Mi 5s Plus;https://fdn2.gsmarena.com/vv/bigpic/xiaomi-mi-5s-plus.jpg;;Silver, Gray, Gold, Rose Gold;20;1;;
6201;Mi 5s;https://fdn2.gsmarena.com/vv/bigpic/xiaomi-mi-5s1.jpg;;Silver, Gray, Gold, Rose Gold;20;1;;
6202;Redmi Note 4 (MediaTek);https://fdn2.gsmarena.com/vv/bigpic/xiaomi-redmi-note-4.jpg;;Silver, Gray, Gold, Blue, Black;20;1;;
6203;Redmi Pro;https://fdn2.gsmarena.com/vv/bigpic/xiaomi-redmi-pro.jpg;;Silver, Gold, Gray;20;1;;
6204;Redmi 3x;https://fdn2.gsmarena.com/vv/bigpic/xiaomi-redmi-3x.jpg;;Gold, Dark Gray, Silver;20;1;;
6205;Redmi 3s Prime;https://fdn2.gsmarena.com/vv/bigpic/xiaomi-redmi-3-pro-.jpg;;Gold, Dark Gray, Silver;20;1;;
6206;Redmi 3s;https://fdn2.gsmarena.com/vv/bigpic/xiaomi-redmi-3s.jpg;;Gold, Dark Gray, Silver;20;1;;
6207;Redmi 3 Pro;https://fdn2.gsmarena.com/vv/bigpic/xiaomi-redmi-3-pro-.jpg;;Dark Gray, Silver, Gold;20;1;;
6208;Mi Max;https://fdn2.gsmarena.com/vv/bigpic/xiaomi-mi-max-.jpg;;Gray, Silver, Gold;20;1;;
6209;Mi 5;https://fdn2.gsmarena.com/vv/bigpic/xiaomi-mi-5.jpg;;Black, White, Gold, Ceramic;20;1;;
6210;Mi 4s;https://fdn2.gsmarena.com/vv/bigpic/xiaomi-mi-4s.jpg;;Black, White, Gold, Pink;20;1;;
6211;Redmi Note 3;https://fdn2.gsmarena.com/vv/bigpic/xiaomi-redmi-note-3.jpg;;Silver, Gray, Gold;20;1;;
6212;Redmi 3;https://fdn2.gsmarena.com/vv/bigpic/xiaomi-redmi-3-.jpg;;Gold, Dark Gray, Silver, Classic Gold;20;1;;
6213;Redmi Note Prime;https://fdn2.gsmarena.com/vv/bigpic/xiaomi-redmi-note-prime-.jpg;;White;20;1;;
6214;Mi Pad 2;https://fdn2.gsmarena.com/vv/bigpic/xiaomi-mi-pad-2.jpg;;Dark grey, Champagne gold;20;2;;
6215;Redmi Note 3 (MediaTek);https://fdn2.gsmarena.com/vv/bigpic/xiaomi-redmi-note-3.jpg;;Silver, Gray, Gold;20;1;;
6216;Mi 4c;https://fdn2.gsmarena.com/vv/bigpic/xiaomi-mi-4c.jpg;;White, grey, pink, yellow, blue;20;1;;
6217;Redmi Note 2;https://fdn2.gsmarena.com/vv/bigpic/xiaomi-redmi-note-2--.jpg;;White, blue, yellow, pink, mint green;20;1;;
6218;Redmi 2 Pro;https://fdn2.gsmarena.com/vv/bigpic/xiaomi-redmi-2-prime-.jpg;;Dark gray;20;1;;
6219;Redmi 2 Prime;https://fdn2.gsmarena.com/vv/bigpic/xiaomi-redmi-2-prime-.jpg;;White, Dark gray;20;1;;
6220;Mi 4i;https://fdn2.gsmarena.com/vv/bigpic/xiaomi-mi4i.jpg;;Dark Gray, Black, White, Yellow, Blue, Pink;20;1;;
6221;Mi Note Pro;https://fdn2.gsmarena.com/vv/bigpic/xiaomi-note-pro2.jpg;;Black, White, Gold;20;1;;
6222;Mi Note;https://fdn2.gsmarena.com/vv/bigpic/xiaomi-note-2015.jpg;;Black, White;20;1;;
6223;Redmi 2A;https://fdn2.gsmarena.com/vv/bigpic/xiaomi-redmi-2.jpg;;Black, Green, Yellow, Pink;20;1;;
6224;Redmi 2;https://fdn2.gsmarena.com/vv/bigpic/xiaomi-redmi-2.jpg;;Black, White, Yellow, Pink, Green;20;1;;
6225;Mi 4 LTE;https://fdn2.gsmarena.com/vv/bigpic/xiaomi-mi-4-lte.jpg;;White;20;1;;
6226;Redmi Note 4G;https://fdn2.gsmarena.com/vv/bigpic/xiaomi-redmi-note-4g.jpg;;Black/White;20;1;;
6227;Mi 4;https://fdn2.gsmarena.com/vv/bigpic/xiaomi-mi-4.jpg;;Black, White;20;1;;
6228;Mi Pad 7.9;https://fdn2.gsmarena.com/vv/bigpic/xiaomi-mi-pad-79.jpg;;Blue, Green, Yellow, Pink, White, Gray;20;2;;
6229;Redmi Note;https://fdn2.gsmarena.com/vv/bigpic/xiaomi-redmi-note-new.jpg;;Black, White;20;1;;
6230;Mi 3;https://fdn2.gsmarena.com/vv/bigpic/xiaomi-mi3.jpg;;White, Gray, Black, Yellow, Pink, Blue, Gold, Green;20;1;;
6231;Redmi 1S;https://fdn2.gsmarena.com/vv/bigpic/Xiaomi-Hongmi-Redmi-1s.jpg;;Black, Chinese Red, Metallic Gray/ blue, green, yellow panels;20;1;;
6232;Redmi;https://fdn2.gsmarena.com/vv/bigpic/xiaomi-hongmi.jpg;;Black, Chinese Red, Metallic Gray/ blue, green, yellow panels;20;1;;
6233;Mi 2A;https://fdn2.gsmarena.com/vv/bigpic/xiaomi-mi2a.jpg;;Black (front panel), 4 color options (back panel);20;1;;
6234;Mi 2S;https://fdn2.gsmarena.com/vv/bigpic/xiaomi-mi2s.jpg;;Black/white, black/blue, black/yellow, black/green, black/pink;20;1;;
6235;Mi 2;https://fdn2.gsmarena.com/vv/bigpic/xiaomi-mi2.jpg;;White, green, blue, red;20;1;;
6236;Mi 1S;https://fdn2.gsmarena.com/vv/bigpic/xiaomi-mi1.jpg;;White, green, blue, red, violet, orange, gray;20;1;;
6237;12 Lite NE;https://fdn2.gsmarena.com/vv/bigpic/xiaomi-civi2.jpg;;Black, Blue, Violet, Silver;20;1;;
6238;Redmi 11;https://fdn2.gsmarena.com/vv/bigpic/xiaomi-redmi-note-11e.jpg;;"Gray; other colors";20;1;;
6239;Redmi 10 Prime+ 5G;https://fdn2.gsmarena.com/vv/bigpic/smartphone.jpg;;Gray, Silver, Blue;20;1;;
6240;Poco X4 NFC;https://fdn2.gsmarena.com/vv/bigpic/smartphone.jpg;;Mysterious Black, Forest Green, Timeless Purple, Milky Way Blue;20;1;;
6241;Poco M3 Pro;https://fdn2.gsmarena.com/vv/bigpic/xiaomi-poco-m3-pro-4g.jpg;;Poco Yellow, Power Black, Cool Blue;20;1;;
6242;Redmi 20X;https://fdn2.gsmarena.com/vv/bigpic/smartphone.jpg;;Black, Silver, Blue, Green;20;1;;
6243;Redmi 11A;https://fdn2.gsmarena.com/vv/bigpic/xiaomi-redmi-11a-r.jpg;;"Black; other colors";20;1;;
6244;Mi 10 Lite Zoom;https://fdn2.gsmarena.com/vv/bigpic/smartphone.jpg;;Blue, White, Black, Green, Orange/Peach;20;1;;
6245;Mi 9X;https://fdn2.gsmarena.com/vv/bigpic/smartphone.jpg;;Various;20;1;;
6246;Mi Max 4 Pro;https://fdn2.gsmarena.com/vv/bigpic/smartphone.jpg;;Black, Champagne Gold, Blue;20;1;;
6247;Mi Max 4;https://fdn2.gsmarena.com/vv/bigpic/smartphone.jpg;;Black, Champagne Gold, Blue;20;1;;
6248;Mi 6c;https://fdn2.gsmarena.com/vv/bigpic/smartphone.jpg;;Black, Gold, Rose Gold;20;1;;
6249;Redmi Pro 2;https://fdn2.gsmarena.com/vv/bigpic/smartphone.jpg;;Red, Blue, Black;20;1;;
6250;Mi Note Plus;https://fdn2.gsmarena.com/vv/bigpic/smartphone.jpg;;Black, White;20;1;;
